### ISSUE TITLE
RTCM Fails to Connect

### ISSUE THREAD

**Issue by tsawyer** [AllStarLink/app_rpt#22]
A known working RTCM will not connect. 

tcpdump shows packets arriving from RTCM... 

```
tcpdump port 667
tcpdump: verbose output suppressed, use -v or -vv for full protocol decode
listening on enp2s0, link-type EN10MB (Ethernet), capture size 262144 bytes
06:00:41.915247 IP 192.168.1.15.667 > 192.168.1.9.667: UDP, length 25
06:00:42.435212 IP 192.168.1.15.667 > 192.168.1.9.667: UDP, length 25
06:00:42.955301 IP 192.168.1.15.667 > 192.168.1.9.667: UDP, length 25
06:00:43.475270 IP 192.168.1.15.667 > 192.168.1.9.667: UDP, length 25
06:00:43.995172 IP 192.168.1.15.667 > 192.168.1.9.667: UDP, length 25
06:00:44.515258 IP 192.168.1.15.667 > 192.168.1.9.667: UDP, length 25
06:00:45.035251 IP 192.168.1.15.667 > 192.168.1.9.667: UDP, length 25
06:00:45.555264 IP 192.168.1.15.667 > 192.168.1.9.667: UDP, length 25
06:00:46.075341 IP 192.168.1.15.667 > 192.168.1.9.667: UDP, length 25
06:00:46.595398 IP 192.168.1.15.667 > 192.168.1.9.667: UDP, length 25
06:00:47.115222 IP 192.168.1.15.667 > 192.168.1.9.667: UDP, length 25
```

...but there is no sign of connection internal to Asterisk.
```=========================================================================
Connected to Asterisk 18.10.1 currently running on NewASL (pid = 419)
NewASL*CLI> core set debug 10
Core debug was OFF and is now 10.
NewASL*CLI> voter debug level 15
Usage: voter debug level {0-7}
       Enables debug messages in chan_voter
NewASL*CLI> voter debug level 7
voter Debugging enabled, previous level: 0, new level: 7
```

chan_voter appears to be loaded as voter commands work. However the display command shows no "client" login, nor does the RTCM itself.
```
NewASL*CLI> voter display 2509
VOTER INSTANCE 2509 DISPLAY:



VOTER INSTANCE 2509 DISPLAY:



VOTER INSTANCE 2509 DISPLAY:



VOTER INSTANCE 2509 DISPLAY:



NewASL*CLI>
```
Here's what a normal voter display looks like.

```
rambo4*CLI>voter display 2501
VOTER INSTANCE 2501 DISPLAY:

 Santiago-U |>                                                       | [  0]


VOTER INSTANCE 2501 DISPLAY:

 Santiago-U |>                                                       | [  0]
```
